{
 "$schema": "http://json-schema.org/draft-07/schema#",
 "title": "Filmation castle",
 "description": "Every room in a Filmation game, and the floor shapes they stand on. The editable form: rooms_source.py turns it, with templates.json beside it, into room_data.s, and the room designer opens it as a picture. A room places templates by name; the templates themselves are templates.json's.",
 "type": "object",
 "required": [
  "meta",
  "roomDimensions",
  "rooms"
 ],
 "properties": {
  "meta": {
   "type": "object",
   "description": "About the file rather than the castle -- all but `rules`, which says how the castle's rooms join up. Knight Lore's and Pentagram's rooms_source.py ignore all of it, so nothing here changes one byte of those games.",
   "properties": {
    "version": {
     "type": "integer",
     "description": "The schema's own version."
    },
    "game": {
     "type": "string",
     "description": "Which game, naming a directory under examples/filmation."
    },
    "comment": {
     "type": "string",
     "description": "Prose for whoever opens the file."
    },
    "sprites": {
     "type": "object",
     "description": "Which sheet the graphic names in this file go with. The designer resolves a name through these; the paths are relative to this file, and neither host will follow one that is absolute or climbs out of the game's folder -- the one above metadata/, where a game keeps this file, or this file's own for a game laid out flat.",
     "properties": {
      "sheet": {
       "type": "string",
       "description": "The picture, normally ../art/sprites.png -- or sprites.png, beside this file, for a game laid out flat."
      },
      "atlas": {
       "type": "string",
       "description": "The atlas that names and locates each frame, normally sprites.json."
      },
      "graphics": {
       "type": "string",
       "description": "Which sprite each graphic number draws and the pixel nudge that lines it up, normally graphic_map.json."
      }
     },
     "additionalProperties": false
    },
    "templates": {
     "type": "string",
     "pattern": "^[A-Za-z0-9_.-]+[.]json$",
     "description": "The file this castle's templates are in, beside this one. Required: nothing is assumed about where it is, and it has to name this file back in its own meta.rooms."
    },
    "rules": {
     "type": "object",
     "description": "How this castle's rooms join up and what its builder takes, said here rather than known by the game's name. The room designer reads these; a castle without them -- Knight Lore's, Pentagram's -- keeps the rules the designer has always had for its game. Unlike the rest of meta, the game's own rooms_source.py may insist on them (knightlore128's refuses to build without exits: table).",
     "properties": {
      "exits": {
       "enum": [
        "table"
       ],
       "description": "\"table\": every scenery entry is two bytes, a template and a destination, and a doorway leads to the room its destination names -- 0 included, since 0 is a room -- or nowhere if that is null. Without it, Knight Lore works exits out from the room number and Pentagram reads a byte where 0 means no exit."
      },
      "sceneryPerRoom": {
       "type": "integer",
       "minimum": 1,
       "maximum": 255,
       "description": "The most scenery entries one room may hold: what the count field in the attribute byte can say."
      },
      "lastRoom": {
       "$ref": "#/definitions/byte",
       "description": "The number the last room must have. room_find walks the records to the first number at least the one it wants, so there has to be one at the end that every search stops at."
      },
      "shapeLimit": {
       "type": "integer",
       "minimum": 1,
       "maximum": 32,
       "description": "The most floor shapes a room can name. Without it, 4: the remakes' builders keep the shape in bits 3 and 4 of the attribute byte. The original Knight Lore reads bits 3 to 7, and its castle says 32."
      },
      "yOrigin": {
       "type": "integer",
       "minimum": 0,
       "maximum": 511,
       "description": "The projection's Y origin, unwrapped: the screen row a point is drawn on is this less half its V less U, plus 64, and its Z. Without it, 296 -- 40 and a whole byte -- which is Knight Lore's and Pentagram's, whose projections subtract 104. Alien 8's subtracts 40 with its floor 64 lower, and says 232."
      },
      "startSpot": {
       "type": "object",
       "required": ["u", "v", "z", "sizeU", "sizeV", "sizeZ"],
       "description": "Where the player is put when a game starts, whichever starting room: a starting room needs this box clear. Without it, Knight Lore's and Pentagram's -- the middle of a floor at 128, 5 either way and 23 high. Alien 8's robot starts on a floor at 64, 7 either way.",
       "properties": {
        "u": {"$ref": "#/definitions/byte"}, "v": {"$ref": "#/definitions/byte"}, "z": {"$ref": "#/definitions/byte"},
        "sizeU": {"$ref": "#/definitions/byte"}, "sizeV": {"$ref": "#/definitions/byte"}, "sizeZ": {"$ref": "#/definitions/byte"}
       },
       "additionalProperties": false
      },
      "groupShiftZ": {
       "type": "boolean",
       "description": "true: an object group may carry a shift in Z (its `shiftZ`), which the builder keeps in the five spare bits of the group's count byte and adds to every object in the group -- Lightkeep's. The room designer makes and merges these groups itself as objects are raised and lowered."
      },
      "groupNudge": {
       "type": "boolean",
       "description": "true: an object group may carry a placement nudge of its own (its `nudge`), as Alien 8's rooms set one for the groups after a header."
      },
      "objectTemplateLimit": {
       "type": "integer",
       "minimum": 1,
       "maximum": 255,
       "description": "The most object templates the castle may have: 32 for the original Knight Lore, 31 for Pentagram, 60 for Alien 8's two pages."
      },
      "poolLimit": {
       "type": "integer",
       "minimum": 1,
       "maximum": 255,
       "description": "The most records one room may expand to -- every entry of every template it places. Without it the builder sizes its pool to the fullest room; the original Knight Lore's is fixed at 36, and a room over it overwrites the font."
      },
      "groupBytes": {
       "enum": [
        2
       ],
       "description": "2: an object group starts with the template's index and the count as a byte each, so a castle can have up to 255 object templates. Without it, the games' one byte packs the template into five bits and the count into three, which holds 32."
      }
     },
     "additionalProperties": false
    }
   },
   "required": [
    "templates"
   ]
  },
  "startRooms": {
   "type": "array",
   "items": { "$ref": "#/definitions/byte" },
   "description": "The rooms a game can start in, for a castle that says. The original Knight Lore picks one of four at random, from start_locations at $D1E2. The room designer lists them under its map; each has to be a room."
  },
  "roomDimensions": {
   "type": "object",
   "description": "The floor shapes a room can have, keyed by name. room_shape copies the three bytes into room_half_u, room_half_v and room_floor_z; the floor is centred on 128 along both axes. The key ORDER is the game's own -- bits 3 and 4 of a room's attribute byte index this table straight -- so a shape may be renamed but not moved.",
   "minProperties": 1,
   "additionalProperties": {
    "type": "object",
    "required": [
     "u",
     "v",
     "z"
    ],
    "properties": {
     "u": {
      "$ref": "#/definitions/byte",
      "description": "Half-width along U."
     },
     "v": {
      "$ref": "#/definitions/byte",
      "description": "Half-width along V."
     },
     "z": {
      "$ref": "#/definitions/byte",
      "description": "The floor's height: where a piece resting on the floor sits."
     }
    },
    "additionalProperties": false
   }
  },
  "rooms": {
   "type": "array",
   "description": "The castle. A room is a colour, a floor shape and a handful of indices; room_build.s expands those into the records the engine draws.",
   "items": {
    "type": "object",
    "required": [
     "number",
     "ink",
     "dimensions"
    ],
    "properties": {
     "number": {
      "$ref": "#/definitions/byte",
      "description": "The room's own number. In Knight Lore the map is arithmetic -- a 16 x 16 grid, so the number is a row and a column -- and in Pentagram, and any castle whose exits are a table, each doorway carries its destination instead."
     },
     "ink": {
      "type": "integer",
      "minimum": 0,
      "maximum": 7,
      "description": "The room's ink colour, 0 to 7. Black on black would be a room you cannot see."
     },
     "dimensions": {
      "type": "string",
      "minLength": 1,
      "description": "Which of `roomDimensions` gives this room its floor, by name."
     },
     "sky": {
      "type": "boolean",
      "description": "knightlore128: whether things can fall into this room out of the sky, as they do in Pentagram. A sky room loads the flyers' sprites as well as its own. Left out means no sky."
     },
     "down": {
      "$ref": "#/definitions/byte",
      "description": "Lightkeep: the room below, reached by falling through a hole in this one. The floor is lowered and walked on as invisible solid boxes round the hole; whatever drops 24 below the floor arrives there 96 higher, at the same U and V. Left out means no way down."
     },
     "up": {
      "$ref": "#/definitions/byte",
      "description": "Lightkeep: the room above, reached by climbing stairs or a ledge in this one to 72 above the floor; he arrives there 96 lower, at the same U and V, on the stairs that carry on up out of its hole. Left out means no way up."
     },
     "scenery": {
      "type": "array",
      "description": "The scenery templates this room is built from, in the order they are drawn.",
      "items": {
       "type": "object",
       "required": [
        "template"
       ],
       "properties": {
        "template": {
         "type": "string",
         "description": "A name from sceneryTemplates."
        },
        "destination": {
         "anyOf": [
          {
           "$ref": "#/definitions/byte"
          },
          {
           "type": "null"
          }
         ],
         "description": "The room a doorway leads to, in a castle that stores one: Pentagram on every entry, where 0 means no way out; a castle whose meta.rules.exits is \"table\" on doorways only, where 0 is a room and null is a doorway walled up. Knight Lore works its own out from the room number."
        }
       },
       "additionalProperties": false
      }
     },
     "objects": {
      "type": "array",
      "description": "Object templates, each stamped at one or more places on the floor grid.",
      "items": {
       "type": "object",
       "required": [
        "template",
        "positions"
       ],
       "properties": {
        "template": {
         "type": "string",
         "description": "A name from objectTemplates."
        },
        "shiftZ": {
         "type": "integer",
         "minimum": -64,
         "maximum": 60,
         "multipleOf": 4,
         "description": "Added to the Z of every object in the group, where the castle's rules say groupShiftZ: so an object can stand between the four levels, above them or below the floor. Nothing here when it is 0. The room designer writes it; nobody need."
        },
        "nudge": {
         "$ref": "#/definitions/byte",
         "description": "Alien 8's placement nudge for this group, where the castle's rules say groupNudge: bit 0 moves it half a cell along U, bit 1 along V, and the rest raises it. The game sets it with a header of template 0 before the group; nothing here when it is 0."
        },
        "positions": {
         "type": "array",
         "items": {
          "type": "object",
          "required": [
           "u",
           "v",
           "z"
          ],
          "properties": {
           "u": {
            "$ref": "#/definitions/cell",
            "description": "Floor cell along U, 0 to 7."
           },
           "v": {
            "$ref": "#/definitions/cell",
            "description": "Floor cell along V, 0 to 7."
           },
           "z": {
            "$ref": "#/definitions/level",
            "description": "Which level up, 0 to 3. room_unpack turns it into 12 units a level."
           },
           "nudge": {
            "$ref": "#/definitions/byte",
            "description": "Knight Lore only: a sixth byte nudging this one placement."
           }
          },
          "additionalProperties": false
         }
        }
       },
       "additionalProperties": false
      }
     }
    },
    "additionalProperties": false
   }
  }
 },
 "additionalProperties": false,
 "definitions": {
  "byte": {
   "type": "integer",
   "minimum": 0,
   "maximum": 255
  },
  "cell": {
   "type": "number",
   "minimum": 0,
   "maximum": 7,
   "multipleOf": 0.5
  },
  "level": {
   "type": "number",
   "minimum": 0,
   "maximum": 3,
   "multipleOf": 0.5
  },
  "graphic": {
   "type": "string",
   "description": "A sprite's name from the sheet, not a number: a path through the sprite groups, then which one it is within its group, counting from one -- knight.legs.1. A frame shared by several graphic numbers takes the number as a last segment (knight.legs.1.g144), because they are not interchangeable. A graphic with no artwork at all is gfx_NN. graphics.py is the one place names and numbers meet; rooms_source.py stops on a name it cannot place rather than emit a wrong byte."
  },
  "flags": {
   "type": "object",
   "description": "The game's own flag byte. Two bits are known and named; the rest are carried whole rather than guessed at.",
   "properties": {
    "mirrored": {
     "type": "boolean",
     "description": "Bit 6: draw the artwork the other way round. The nudge may differ when it is -- see graphic_map.json."
    },
    "passable": {
     "type": "boolean",
     "description": "Bit 1: things walk through it rather than into it."
    },
    "rest": {
     "$ref": "#/definitions/byte",
     "description": "The bits we have not named, kept so the file claims no more than is actually known."
    }
   },
   "additionalProperties": false
  }
 }
}
