{
 "meta": {
  "version": 1,
  "game": "lightkeep",
  "comment": "Knight Lore's castle, forked for the 128K on 2026-09-24; the same schema Pentagram's rooms.py writes.",
  "sprites": {
   "sheet": "../art/sprites.png",
   "atlas": "sprites.json",
   "graphics": "graphics.json"
  },
  "templates": "templates.json",
  "rules": {
   "exits": "table",
   "sceneryPerRoom": 7,
   "lastRoom": 255,
   "groupBytes": 2,
   "groupShiftZ": true
  }
 },

 "roomDimensions": {
  "square":  { "u": 64, "v": 64, "z": 128 },
  "narrowU": { "u": 32, "v": 64, "z": 128 },
  "narrowV": { "u": 64, "v": 32, "z": 128 }
 },

 "startRooms": [167],

 "rooms": [
  { "number": 0, "ink": 3, "dimensions": "square",
    "scenery": [
     { "template": "scenery_melkhior_door_n", "destination": 16 },
     { "template": "scenery_melkhior_door_e", "destination": 1 },
     { "template": "scenery_walls_0" }
    ],
    "objects": [
     { "template": "object_block", "positions": [
      { "u": 0, "v": 2, "z": 0 },
      { "u": 0, "v": 2, "z": 1 },
      { "u": 0, "v": 2, "z": 2 },
      { "u": 1, "v": 2, "z": 0 },
      { "u": 1, "v": 2, "z": 1 },
      { "u": 1, "v": 2, "z": 2 },
      { "u": 2, "v": 1, "z": 0 },
      { "u": 2, "v": 1, "z": 1 }
     ] },
     { "template": "object_block", "positions": [
      { "u": 2, "v": 1, "z": 2 },
      { "u": 2, "v": 0, "z": 0 },
      { "u": 2, "v": 0, "z": 1 },
      { "u": 2, "v": 0, "z": 2 },
      { "u": 0, "v": 1, "z": 3 },
      { "u": 1, "v": 0, "z": 3 },
      { "u": 0, "v": 0, "z": 3 }
     ] },
     { "template": "object_dropping_block", "positions": [
      { "u": 1, "v": 1, "z": 3 }
     ] }
    ]
  },
  { "number": 1, "ink": 4, "dimensions": "narrowV",
    "scenery": [
     { "template": "scenery_arch_e", "destination": 2 },
     { "template": "scenery_arch_w", "destination": 0 },
     { "template": "scenery_walls_1" }
    ],
    "objects": [
     { "template": "object_block", "positions": [
      { "u": 3, "v": 5, "z": 0 },
      { "u": 4, "v": 5, "z": 0 },
      { "u": 3, "v": 2, "z": 0 },
      { "u": 4, "v": 2, "z": 0 }
     ] },
     { "template": "object_gargoyle", "positions": [
      { "u": 3, "v": 5, "z": 1 },
      { "u": 4, "v": 5, "z": 1 },
      { "u": 3, "v": 2, "z": 1 },
      { "u": 4, "v": 2, "z": 1 }
     ] },
     { "template": "object_guard_ew", "positions": [
      { "u": 4, "v": 3, "z": 0 }
     ] },
     { "template": "object_ghost", "positions": [
      { "u": 0, "v": 5, "z": 0 }
     ] }
    ]
  },
  { "number": 2, "ink": 3, "dimensions": "square",
    "scenery": [
     { "template": "scenery_arch_n", "destination": 18 },
     { "template": "scenery_arch_e", "destination": 3 },
     { "template": "scenery_arch_w", "destination": 1 },
     { "template": "scenery_walls_0" }
    ],
    "objects": []
  },
  { "number": 3, "ink": 6, "dimensions": "narrowV",
    "scenery": [
     { "template": "scenery_arch_e", "destination": 4 },
     { "template": "scenery_arch_w", "destination": 2 },
     { "template": "scenery_walls_1" }
    ],
    "objects": [
     { "template": "object_block", "positions": [
      { "u": 2, "v": 4, "z": 0 },
      { "u": 2, "v": 3, "z": 0 },
      { "u": 5, "v": 4, "z": 0 },
      { "u": 5, "v": 3, "z": 0 }
     ] },
     { "template": "object_spike", "positions": [
      { "u": 3, "v": 4, "z": 0 },
      { "u": 3, "v": 3, "z": 0 },
      { "u": 4, "v": 4, "z": 0 },
      { "u": 4, "v": 3, "z": 0 }
     ] },
     { "template": "object_spike_ball", "positions": [
      { "u": 3, "v": 5, "z": 0 },
      { "u": 4, "v": 5, "z": 0 },
      { "u": 3, "v": 2, "z": 0 },
      { "u": 4, "v": 2, "z": 0 }
     ] },
     { "template": "object_collapsing_block", "positions": [
      { "u": 3, "v": 4, "z": 1 },
      { "u": 4, "v": 4, "z": 1 },
      { "u": 3, "v": 3, "z": 1 },
      { "u": 4, "v": 3, "z": 1 }
     ] }
    ]
  },
  { "number": 4, "ink": 5, "dimensions": "square",
    "scenery": [
     { "template": "scenery_arch_n", "destination": 20 },
     { "template": "scenery_arch_w", "destination": 3 },
     { "template": "scenery_walls_0" }
    ],
    "objects": [
     { "template": "object_spike", "positions": [
      { "u": 3, "v": 4, "z": 0 },
      { "u": 2, "v": 3, "z": 0 },
      { "u": 4, "v": 3, "z": 0 },
      { "u": 3, "v": 2, "z": 0 }
     ] },
     { "template": "object_collapsing_block", "positions": [
      { "u": 2, "v": 3, "z": 1 },
      { "u": 4, "v": 3, "z": 1 },
      { "u": 3, "v": 2, "z": 1 }
     ] },
     { "template": "object_block", "positions": [
      { "u": 3, "v": 4, "z": 1 },
      { "u": 3, "v": 3, "z": 2 },
      { "u": 3, "v": 3, "z": 3 }
     ] }
    ]
  },
  { "number": 8, "ink": 3, "dimensions": "square",
    "scenery": [
     { "template": "scenery_tree_arch_n", "destination": 24 },
     { "template": "scenery_tree_arch_e", "destination": 9 },
     { "template": "scenery_trees_0" },
     { "template": "scenery_trees_1" }
    ],
    "objects": [
     { "template": "object_rock", "positions": [
      { "u": 3, "v": 3, "z": 0 },
      { "u": 3, "v": 3, "z": 1 },
      { "u": 3, "v": 3, "z": 2 },
      { "u": 3, "v": 3, "z": 3 }
     ] },
     { "template": "object_spike", "positions": [
      { "u": 3, "v": 4, "z": 0 },
      { "u": 2, "v": 3, "z": 0 },
      { "u": 4, "v": 3, "z": 0 },
      { "u": 3, "v": 2, "z": 0 }
     ] },
     { "template": "object_spike_ball", "positions": [
      { "u": 3, "v": 4, "z": 1 },
      { "u": 2, "v": 3, "z": 1 },
      { "u": 4, "v": 3, "z": 1 },
      { "u": 3, "v": 2, "z": 1 }
     ] },
     { "template": "object_ball_bounce", "positions": [
      { "u": 1, "v": 1, "z": 0 }
     ] },
     { "template": "object_moveable_block", "positions": [
      { "u": 1, "v": 1, "z": 1 }
     ] }
    ]
  },
  { "number": 9, "ink": 6, "dimensions": "square",
    "scenery": [
     { "template": "scenery_tree_arch_e", "destination": 10 },
     { "template": "scenery_tree_arch_w", "destination": 8 },
     { "template": "scenery_trees_0" },
     { "template": "scenery_trees_2" },
     { "template": "scenery_gate_1" },
     { "template": "scenery_gate_3" }
    ],
    "objects": [
     { "template": "object_ghost", "positions": [
      { "u": 3, "v": 4, "z": 0 }
     ] }
    ]
  },
  { "number": 10, "ink": 3, "dimensions": "square",
    "scenery": [
     { "template": "scenery_tree_arch_e", "destination": 11 },
     { "template": "scenery_tree_arch_w", "destination": 9 },
     { "template": "scenery_trees_0" },
     { "template": "scenery_trees_2" }
    ],
    "objects": [
     { "template": "object_rock", "positions": [
      { "u": 2, "v": 4, "z": 0 },
      { "u": 2, "v": 4, "z": 1 },
      { "u": 2, "v": 4, "z": 2 },
      { "u": 4, "v": 4, "z": 0 },
      { "u": 4, "v": 4, "z": 1 },
      { "u": 4, "v": 4, "z": 2 }
     ] },
     { "template": "object_spike", "positions": [
      { "u": 2, "v": 5, "z": 0 },
      { "u": 3, "v": 5, "z": 0 },
      { "u": 3, "v": 5, "z": 1 },
      { "u": 4, "v": 5, "z": 0 },
      { "u": 2, "v": 3, "z": 0 },
      { "u": 3, "v": 3, "z": 0 },
      { "u": 3, "v": 3, "z": 1 },
      { "u": 4, "v": 3, "z": 0 }
     ] },
     { "template": "object_table", "positions": [
      { "u": 6, "v": 1, "z": 0 }
     ] }
    ]
  },
  { "number": 11, "ink": 6, "dimensions": "square",
    "scenery": [
     { "template": "scenery_tree_arch_e", "destination": 12 },
     { "template": "scenery_tree_arch_w", "destination": 10 },
     { "template": "scenery_trees_0" },
     { "template": "scenery_trees_2" }
    ],
    "objects": []
  },
  { "number": 12, "ink": 3, "dimensions": "square",
    "scenery": [
     { "template": "scenery_tree_arch_e", "destination": 13 },
     { "template": "scenery_tree_arch_w", "destination": 11 },
     { "template": "scenery_trees_0" },
     { "template": "scenery_trees_2" }
    ],
    "objects": [
     { "template": "object_spike", "positions": [
      { "u": 5, "v": 7, "z": 0 },
      { "u": 2, "v": 6, "z": 0 },
      { "u": 0, "v": 5, "z": 0 },
      { "u": 4, "v": 5, "z": 0 },
      { "u": 7, "v": 5, "z": 0 },
      { "u": 2, "v": 4, "z": 0 },
      { "u": 4, "v": 3, "z": 0 },
      { "u": 0, "v": 2, "z": 0 }
     ] },
     { "template": "object_spike", "positions": [
      { "u": 2, "v": 2, "z": 0 },
      { "u": 7, "v": 2, "z": 0 },
      { "u": 5, "v": 1, "z": 0 },
      { "u": 4, "v": 0, "z": 0 }
     ] },
     { "template": "object_ball_bounce", "positions": [
      { "u": 4, "v": 4, "z": 0 }
     ] }
    ]
  },
  { "number": 13, "ink": 4, "dimensions": "square",
    "scenery": [
     { "template": "scenery_arch_n", "destination": 29 },
     { "template": "scenery_arch_e", "destination": 14 },
     { "template": "scenery_arch_w", "destination": 12 },
     { "template": "scenery_walls_0" }
    ],
    "objects": []
  },
  { "number": 14, "ink": 5, "dimensions": "narrowV",
    "scenery": [
     { "template": "scenery_arch_e", "destination": 15 },
     { "template": "scenery_arch_w", "destination": 13 },
     { "template": "scenery_walls_1" }
    ],
    "objects": [
     { "template": "object_fire_ns", "positions": [
      { "u": 2, "v": 2, "z": 0 },
      { "u": 5, "v": 3, "z": 0 },
      { "u": 4, "v": 5, "z": 0 },
      { "u": 3, "v": 4, "z": 0 }
     ] }
    ]
  },
  { "number": 15, "ink": 4, "dimensions": "square",
    "scenery": [
     { "template": "scenery_arch_n", "destination": 31 },
     { "template": "scenery_arch_w", "destination": 14 },
     { "template": "scenery_walls_0" }
    ],
    "objects": [
     { "template": "object_block", "positions": [
      { "u": 3, "v": 4, "z": 0 },
      { "u": 5, "v": 4, "z": 0 },
      { "u": 3, "v": 2, "z": 0 },
      { "u": 5, "v": 2, "z": 0 },
      { "u": 3, "v": 4, "z": 1 },
      { "u": 4, "v": 4, "z": 1 },
      { "u": 5, "v": 4, "z": 1 },
      { "u": 3, "v": 3, "z": 1 }
     ] },
     { "template": "object_block", "positions": [
      { "u": 5, "v": 3, "z": 1 },
      { "u": 3, "v": 2, "z": 1 },
      { "u": 4, "v": 2, "z": 1 },
      { "u": 5, "v": 2, "z": 1 },
      { "u": 4, "v": 3, "z": 0 }